"Journal Data Filtered By:  Selected JCR Year: 2018 Selected Editions: SCIE,SSCI Selected Categories: 'FOOD SCIENCE & TECHNOLOGY' Selected Category Scheme: WoS",,,,,
Rank,Full Journal Title,Total Cites,Journal Impact Factor,Eigenfactor Score,Article Influence Score
1,COMPREHENSIVE REVIEWS IN FOOD SCIENCE AND FOOD SAFETY,"5,682",8.738,0.008000,2.198
2,TRENDS IN FOOD SCIENCE & TECHNOLOGY,"14,653",8.519,0.014760,1.803
3,Annual Review of Food Science and Technology,"1,887",8.511,0.003160,2.216
4,CRITICAL REVIEWS IN FOOD SCIENCE AND NUTRITION,"12,591",6.704,0.015020,1.458
5,FOOD HYDROCOLLOIDS,"23,287",5.839,0.025340,0.985
6,Global Food Security-Agriculture Policy Economics and Environment,"1,219",5.456,0.003920,1.845
7,FOOD CHEMISTRY,"104,574",5.399,0.103860,0.955
8,Food and Energy Security,413,4.781,0.001110,1.192
9,MOLECULAR NUTRITION & FOOD RESEARCH,"12,276",4.653,0.015850,1.021
10,Antioxidants,882,4.520,0.001690,Not Available
11,FOOD CONTROL,"20,900",4.248,0.029850,0.781
12,Food Engineering Reviews,943,4.217,0.001360,1.005
13,JOURNAL OF FOOD AND DRUG ANALYSIS,"3,071",4.176,0.004570,0.754
14,FOOD MICROBIOLOGY,"10,786",4.089,0.012130,0.965
15,Innovative Food Science & Emerging Technologies,"7,847",4.085,0.009650,0.827
16,INTERNATIONAL JOURNAL OF FOOD MICROBIOLOGY,"26,840",4.006,0.019630,0.892
17,FOOD REVIEWS INTERNATIONAL,"1,776",3.933,0.001030,0.756
18,POSTHARVEST BIOLOGY AND TECHNOLOGY,"11,753",3.927,0.009870,0.722
19,Toxins,"7,709",3.895,0.015920,0.842
20,Current Opinion in Food Science,"1,162",3.828,0.002860,0.814
21,FOOD POLICY,"6,102",3.788,0.009030,1.258
22,FOOD AND CHEMICAL TOXICOLOGY,"26,870",3.775,0.022540,0.755
23,LWT-FOOD SCIENCE AND TECHNOLOGY,"25,642",3.714,0.032240,0.729
24,FOOD QUALITY AND PREFERENCE,"7,933",3.684,0.008990,0.827
25,Food Packaging and Shelf Life,769,3.630,0.001370,Not Available
26,JOURNAL OF FOOD ENGINEERING,"27,021",3.625,0.018300,0.727
27,FOOD RESEARCH INTERNATIONAL,"26,072",3.579,0.031630,0.870
28,JOURNAL OF AGRICULTURAL AND FOOD CHEMISTRY,"109,151",3.571,0.066550,0.764
29,MEAT SCIENCE,"20,444",3.483,0.014400,0.739
30,FOOD AND BIOPRODUCTS PROCESSING,"3,846",3.324,0.004930,0.645
31,Food & Function,"8,392",3.241,0.016730,0.683
32,Food Bioscience,798,3.220,0.001590,Not Available
33,Journal of Functional Foods,"9,844",3.197,0.019560,0.685
34,JOURNAL OF DAIRY SCIENCE,"48,844",3.082,0.031720,0.568
35,Food and Bioprocess Technology,"7,206",3.032,0.011500,0.682
36,Foods,"1,095",3.011,0.002420,Not Available
37,JOURNAL OF FOOD COMPOSITION AND ANALYSIS,"7,374",2.994,0.006000,0.665
38,INTERNATIONAL JOURNAL OF FOOD SCIENCES AND NUTRITION,"4,135",2.792,0.004450,0.528
39,INTERNATIONAL DAIRY JOURNAL,"8,541",2.735,0.005590,0.557
40,PLANT FOODS FOR HUMAN NUTRITION,"3,134",2.598,0.002180,0.525
41,Food & Nutrition Research,"1,388",2.553,0.002890,0.638
42,JOURNAL OF CEREAL SCIENCE,"8,219",2.452,0.006250,0.584
43,JOURNAL OF THE SCIENCE OF FOOD AND AGRICULTURE,"22,298",2.422,0.018750,0.554
44,Food Additives & Contaminants Part B-Surveillance,803,2.419,0.001150,0.366
45,Food Analytical Methods,"4,426",2.413,0.008540,0.418
46,Food Biophysics,"1,235",2.411,0.001550,0.514
47,BIOTECHNOLOGY PROGRESS,"8,426",2.406,0.005710,0.502
47,World Mycotoxin Journal,"1,076",2.406,0.001500,0.449
49,FOOD AND AGRICULTURAL IMMUNOLOGY,"1,053",2.398,0.001050,0.225
50,Analytical Methods,"13,640",2.378,0.027720,0.396
51,AUSTRALIAN JOURNAL OF GRAPE AND WINE RESEARCH,"2,374",2.343,0.002180,0.593
52,CHEMICAL SENSES,"4,443",2.336,0.003880,0.863
53,INTERNATIONAL JOURNAL OF FOOD SCIENCE AND TECHNOLOGY,"9,643",2.281,0.008250,0.390
54,Food Additives and Contaminants Part A-Chemistry Analysis Control Exposure & Risk Assessment,"7,732",2.170,0.006380,0.468
55,Food Security,"2,014",2.153,0.003800,0.773
56,JOURNAL OF FOOD SCIENCE,"25,840",2.081,0.010950,0.487
57,JOURNAL OF SENSORY STUDIES,"1,547",2.072,0.001190,0.421
58,EUROPEAN FOOD RESEARCH AND TECHNOLOGY,"8,254",2.056,0.006070,0.434
59,JOURNAL OF BIOSCIENCE AND BIOENGINEERING,"8,324",2.032,0.007120,0.459
60,JOURNAL OF MEDICINAL FOOD,"4,797",2.020,0.004400,0.412
61,Foodborne Pathogens and Disease,"3,884",2.000,0.005210,0.620
62,PACKAGING TECHNOLOGY AND SCIENCE,"1,578",1.881,0.001110,0.285
63,EUROPEAN JOURNAL OF LIPID SCIENCE AND TECHNOLOGY,"5,712",1.852,0.005660,0.443
64,JOURNAL OF FOOD SCIENCE AND TECHNOLOGY-MYSORE,"8,165",1.850,0.013590,0.406
65,STARCH-STARKE,"4,386",1.795,0.003320,0.395
66,AMERICAN JOURNAL OF ENOLOGY AND VITICULTURE,"5,514",1.783,0.001710,0.441
67,Food Science & Nutrition,"1,068",1.747,0.002380,Not Available
68,JOURNAL OF THE AMERICAN OIL CHEMISTS SOCIETY,"11,800",1.720,0.004130,0.354
69,British Food Journal,"3,864",1.717,0.002900,0.277
70,SOUTH AFRICAN JOURNAL OF ENOLOGY AND VITICULTURE,710,1.692,0.000650,0.334
71,JOURNAL OF FOOD SAFETY,"1,290",1.665,0.001280,0.289
72,Agribusiness,981,1.635,0.000740,0.330
73,CyTA-Journal of Food,829,1.605,0.001540,0.315
74,Food Structure-Netherlands,206,1.574,0.000540,Not Available
75,JOURNAL OF TEXTURE STUDIES,"1,944",1.565,0.001020,0.308
76,Applied Biological Chemistry,330,1.559,0.000640,0.263
76,JOURNAL OF FOOD PROTECTION,"13,047",1.559,0.007790,0.413
78,FOOD AND NUTRITION BULLETIN,"2,596",1.523,0.002390,0.598
79,INTERNATIONAL JOURNAL OF DAIRY TECHNOLOGY,"1,617",1.522,0.001350,0.289
79,Journal of Wine Economics,306,1.522,0.000400,Not Available
81,FOOD TECHNOLOGY AND BIOTECHNOLOGY,"2,039",1.517,0.001290,0.327
82,POLISH JOURNAL OF FOOD AND NUTRITION SCIENCES,889,1.514,0.000680,0.328
83,OENO One,76,1.479,0.000260,0.422
84,JOURNAL OF FOOD PROCESS ENGINEERING,"1,777",1.448,0.001940,0.249
85,JOURNAL INTERNATIONAL DES SCIENCES DE LA VIGNE ET DU VIN,467,1.444,0.000300,0.253
86,JOURNAL OF DAIRY RESEARCH,"3,069",1.421,0.001740,0.394
87,Journal of Food Measurement and Characterization,741,1.415,0.001320,0.215
88,INTERNATIONAL JOURNAL OF FOOD PROPERTIES,"3,130",1.398,0.004100,0.240
89,FLAVOUR AND FRAGRANCE JOURNAL,"2,901",1.377,0.001210,0.381
90,JOURNAL OF FOOD QUALITY,"1,525",1.360,0.001480,0.282
91,JOURNAL OF FOOD BIOCHEMISTRY,"1,868",1.358,0.001400,0.227
92,BIOSCIENCE BIOTECHNOLOGY AND BIOCHEMISTRY,"12,501",1.297,0.007020,0.309
93,CEREAL CHEMISTRY,"6,560",1.289,0.002040,0.316
94,JOURNAL OF FOOD PROCESSING AND PRESERVATION,"3,279",1.288,0.004640,0.243
95,JOURNAL OF ESSENTIAL OIL RESEARCH,"2,552",1.233,0.001170,0.254
96,Food Science and Technology,"1,046",1.223,0.002280,0.290
97,FOOD SCIENCE AND TECHNOLOGY INTERNATIONAL,"2,015",1.221,0.001220,0.311
98,Journal of Oleo Science,"1,932",1.208,0.002150,0.237
99,JOURNAL OF AOAC INTERNATIONAL,"5,167",1.201,0.003030,0.226
100,AGRICULTURAL AND FOOD SCIENCE,631,1.200,0.000810,0.435
101,Korean Journal for Food Science of Animal Resources,786,1.145,0.001510,0.215
102,JOURNAL OF THE INSTITUTE OF BREWING,"1,997",0.994,0.001170,0.240
103,International Journal of Food Engineering,781,0.951,0.000910,0.165
104,Journal of Food and Nutrition Research,392,0.927,0.000440,0.176
105,Emirates Journal of Food and Agriculture,765,0.921,0.001380,0.177
106,Journal of Oil Palm Research,497,0.893,0.000340,0.111
107,GRASAS Y ACEITES,"1,279",0.891,0.000780,0.228
108,FOOD SCIENCE AND BIOTECHNOLOGY,"2,926",0.888,0.003550,0.199
109,Ciencia e Tecnica Vitivinicola,110,0.875,0.000130,0.204
110,CZECH JOURNAL OF FOOD SCIENCES,"1,394",0.846,0.001110,0.220
111,Chemosensory Perception,373,0.824,0.000590,0.479
112,JOURNAL OF THE AMERICAN SOCIETY OF BREWING CHEMISTS,756,0.792,0.000320,0.126
113,ITALIAN JOURNAL OF FOOD SCIENCE,645,0.736,0.000600,0.141
114,Quality Assurance and Safety of Crops & Foods,303,0.735,0.000520,0.133
115,Journal of Aquatic Food Product Technology,658,0.707,0.000690,0.131
116,Rivista Italiana delle Sostanze Grasse,223,0.694,0.000150,0.097
117,FOOD BIOTECHNOLOGY,510,0.676,0.000270,0.214
118,International Food Research Journal,"3,108",0.662,0.003630,Not Available
119,IRISH JOURNAL OF AGRICULTURAL AND FOOD RESEARCH,413,0.645,0.000300,0.294
120,Journal of Consumer Protection and Food Safety,427,0.641,0.000440,0.148
121,FOOD AND DRUG LAW JOURNAL,266,0.619,0.000270,0.181
122,Natural Product Communications,"3,699",0.554,0.004260,0.141
123,ACTA ALIMENTARIA,456,0.547,0.000410,0.084
124,CEREAL FOODS WORLD,727,0.509,0.000280,0.180
125,Sugar Industry-Zuckerindustrie,287,0.495,0.000160,0.049
126,FOOD SCIENCE AND TECHNOLOGY RESEARCH,"1,222",0.448,0.001130,0.139
127,Food Hygiene and Safety Science,164,0.357,0.000230,0.080
128,Journal of Food Safety and Food Quality-Archiv fur Lebensmittelhygiene,140,0.282,0.000050,0.038
129,JOURNAL OF THE JAPANESE SOCIETY FOR FOOD SCIENCE AND TECHNOLOGY-NIPPON SHOKUHIN KAGAKU KOGAKU KAISHI,641,0.262,0.000230,0.043
130,LISTY CUKROVARNICKE A REPARSKE,73,0.257,0.000050,0.015
131,MITTEILUNGEN KLOSTERNEUBURG,79,0.217,0.000060,0.031
132,FLEISCHWIRTSCHAFT,291,0.172,0.000080,0.012
133,FOOD TECHNOLOGY,"1,647",0.153,0.000130,0.034
134,INTERNATIONAL SUGAR JOURNAL,293,0.121,0.000160,0.030
135,DEUTSCHE LEBENSMITTEL-RUNDSCHAU,212,0.067,0.000050,0.013
Copyright © 2019 Clarivate Analytics,,,,,
"By exporting the selected data, you agree to the data usage policy set forth in the Terms of Use",,,,,
