"Journal Data Filtered By:  Selected JCR Year: 2017 Selected Editions: SCIE,SSCI Selected Categories: 'BUSINESS' Selected Category Scheme: WoS",,,
Rank,Full Journal Title,Journal Impact Factor,Article Influence Score
1,Academy of Management Annals,9.281,8.618
2,ACADEMY OF MANAGEMENT REVIEW,8.855,6.392
3,JOURNAL OF THE ACADEMY OF MARKETING SCIENCE,8.488,2.333
4,JOURNAL OF MANAGEMENT,8.080,4.705
5,JOURNAL OF MARKETING,7.338,3.580
6,JOURNAL OF SERVICE RESEARCH,6.842,1.649
7,ACADEMY OF MANAGEMENT JOURNAL,6.700,5.301
8,INTERNATIONAL JOURNAL OF MANAGEMENT REVIEWS,6.489,2.155
9,JOURNAL OF INTERNATIONAL BUSINESS STUDIES,6.198,2.235
10,JOURNAL OF BUSINESS VENTURING,6.000,2.620
11,ADMINISTRATIVE SCIENCE QUARTERLY,5.878,6.248
12,STRATEGIC MANAGEMENT JOURNAL,5.482,3.109
13,JOURNAL OF RETAILING,5.480,1.411
14,Business Strategy and the Environment,5.355,0.815
15,JOURNAL OF MANAGEMENT STUDIES,5.329,2.921
16,ENTREPRENEURSHIP THEORY AND PRACTICE,5.321,1.855
17,Corporate Social Responsibility and Environmental Management,4.918,0.556
18,Academy of Management Perspectives,4.686,2.643
19,HARVARD BUSINESS REVIEW,4.374,1.724
20,JOURNAL OF PRODUCT INNOVATION MANAGEMENT,4.305,1.037
21,JOURNAL OF ORGANIZATIONAL BEHAVIOR,4.229,2.165
22,JOURNAL OF WORLD BUSINESS,3.993,0.912
23,International Small Business Journal-Researching Entrepreneurship,3.900,0.668
24,JOURNAL OF INTERACTIVE MARKETING,3.864,1.944
25,JOURNAL OF MARKETING RESEARCH,3.854,3.270
26,Internet Research,3.838,0.601
27,SUPPLY CHAIN MANAGEMENT-AN INTERNATIONAL JOURNAL,3.833,1.057
28,Family Business Review,3.824,1.130
29,Electronic Markets,3.818,0.387
30,INDUSTRIAL MARKETING MANAGEMENT,3.678,0.630
31,Journal of Intellectual Capital,3.634,Not Available
32,JOURNAL OF INTERNATIONAL MARKETING,3.600,0.737
33,JOURNAL OF CONSUMER RESEARCH,3.535,2.466
34,Strategic Entrepreneurship Journal,3.488,1.729
35,CALIFORNIA MANAGEMENT REVIEW,3.302,1.003
36,LONG RANGE PLANNING,3.221,1.348
37,Business & Society,3.214,0.771
38,TECHNOLOGICAL FORECASTING AND SOCIAL CHANGE,3.131,0.697
39,BRITISH JOURNAL OF MANAGEMENT,3.059,0.870
40,Business Ethics-A European Review,3.029,0.274
41,Journal of Retailing and Consumer Services,2.919,Not Available
42,JOURNAL OF BUSINESS ETHICS,2.917,0.689
43,JOURNAL OF ADVERTISING,2.880,0.779
44,SMALL BUSINESS ECONOMICS,2.857,0.868
45,JOURNAL OF CONSUMER PSYCHOLOGY,2.809,1.957
46,MARKETING SCIENCE,2.794,2.606
47,ENTREPRENEURSHIP AND REGIONAL DEVELOPMENT,2.791,0.656
48,Journal of Product and Brand Management,2.757,Not Available
49,International Business Review,2.754,0.514
50,CORPORATE GOVERNANCE-AN INTERNATIONAL REVIEW,2.705,0.660
51,JOURNAL OF ENGINEERING AND TECHNOLOGY MANAGEMENT,2.686,0.524
52,Journal of Hospitality Marketing & Management,2.683,Not Available
53,JOURNAL OF ENVIRONMENTAL ECONOMICS AND MANAGEMENT,2.635,2.061
54,Journal of Family Business Strategy,2.605,0.465
55,INTERNATIONAL MARKETING REVIEW,2.600,0.547
56,INTERNATIONAL JOURNAL OF RESEARCH IN MARKETING,2.593,1.190
57,BUSINESS HORIZONS,2.588,0.521
58,MIT SLOAN MANAGEMENT REVIEW,2.583,1.317
59,Electronic Commerce Research and Applications,2.582,0.694
60,JOURNAL OF BUSINESS AND PSYCHOLOGY,2.576,1.503
61,INTERNATIONAL JOURNAL OF ELECTRONIC COMMERCE,2.514,1.094
62,JOURNAL OF BUSINESS RESEARCH,2.509,0.613
63,International Journal of Advertising,2.494,0.511
64,Marketing Theory,2.466,0.549
65,BRQ-Business Research Quarterly,2.410,0.256
66,Journal of Services Marketing,2.408,0.435
67,International Entrepreneurship and Management Journal,2.406,0.262
68,European Management Journal,2.369,0.609
69,JOURNAL OF ADVERTISING RESEARCH,2.328,0.527
70,International Journal of Bank Marketing,2.294,Not Available
71,Consumption Markets & Culture,2.232,0.438
72,Journal of Marketing Management,2.229,Not Available
73,Strategic Organization,2.225,1.651
74,INDUSTRIAL AND CORPORATE CHANGE,2.198,0.999
75,JOURNAL OF PUBLIC POLICY & MARKETING,2.179,0.687
76,Journal of Vacation Marketing,2.170,Not Available
77,Service Business,2.110,0.296
78,PSYCHOLOGY & MARKETING,2.023,0.579
79,ENGINEERING ECONOMIST,2.000,0.358
79,Journal of Social Marketing,2.000,Not Available
81,Journal of Macromarketing,1.969,0.302
82,International Journal of Entrepreneurial Behaviour & Research,1.863,Not Available
83,JOURNAL OF CONSUMER AFFAIRS,1.860,0.507
84,R & D MANAGEMENT,1.857,0.549
85,JOURNAL OF BUSINESS & INDUSTRIAL MARKETING,1.833,0.234
86,RESEARCH-TECHNOLOGY MANAGEMENT,1.796,0.522
87,BUSINESS ETHICS QUARTERLY,1.757,1.219
88,Journal of Electronic Commerce Research,1.667,0.486
89,Journal of Consumer Behaviour,1.659,0.441
90,International Journal of Business Communication,1.575,Not Available
91,Journal of Brand Management,1.564,Not Available
92,International Journal of Consumer Studies,1.555,0.306
93,MANAGEMENT DECISION,1.525,0.312
94,Journal of Business Economics and Management,1.503,0.174
95,EUROPEAN JOURNAL OF MARKETING,1.497,0.439
96,Electronic Commerce Research,1.489,0.426
97,Marketing Intelligence & Planning,1.421,Not Available
98,IEEE TRANSACTIONS ON ENGINEERING MANAGEMENT,1.416,0.474
99,Journal of Service Theory and Practice,1.395,0.127
100,European Journal of Innovation Management,1.385,Not Available
101,PUBLIC RELATIONS REVIEW,1.378,0.264
102,MARKETING LETTERS,1.350,0.676
103,International Journal of Managing Projects in Business,1.321,Not Available
104,Business Process Management Journal,1.308,Not Available
105,AMERICAN BUSINESS LAW JOURNAL,1.286,0.396
106,JOURNAL OF PRODUCTIVITY ANALYSIS,1.267,0.769
107,Entrepreneurship Research Journal,1.250,0.195
108,Asia Pacific Journal of Marketing and Logistics,1.204,Not Available
109,Asian Business & Management,1.179,0.166
110,BUSINESS HISTORY REVIEW,1.162,0.495
111,Service Science,1.152,Not Available
112,AUSTRALIAN JOURNAL OF MANAGEMENT,1.150,0.249
113,Transformations in Business & Economics,1.112,0.085
114,ORGANIZATIONAL DYNAMICS,1.111,0.367
115,BUSINESS HISTORY,1.075,0.382
116,Information Systems and E-Business Management,1.032,0.251
117,QME-Quantitative Marketing and Economics,1.000,2.111
118,International Journal of Accounting Information Systems,0.969,0.199
119,INTERNATIONAL JOURNAL OF MARKET RESEARCH,0.910,0.287
120,Clothing and Textiles Research Journal,0.850,0.138
121,Asian Journal of Technology Innovation,0.845,0.078
122,EMERGING MARKETS FINANCE AND TRADE,0.828,0.152
123,Asia Pacific Business Review,0.788,0.198
124,Journal of Theoretical and Applied Electronic Commerce Research,0.774,Not Available
125,JOURNAL OF BUSINESS AND TECHNICAL COMMUNICATION,0.750,0.198
126,European Business Organization Law Review,0.723,0.224
127,Sport Marketing Quarterly,0.694,Not Available
128,CANADIAN JOURNAL OF ADMINISTRATIVE SCIENCES-REVUE CANADIENNE DES SCIENCES DE L ADMINISTRATION,0.674,0.157
129,Amfiteatru Economic,0.664,0.062
130,Academia-Revista Latinoamericana de Administracion,0.617,0.080
131,ENTERPRISE & SOCIETY,0.556,0.308
132,Journal of Business-to-Business Marketing,0.459,0.197
133,Zbornik Radova Ekonomskog Fakulteta u Rijeci-Proceedings of Rijeka Faculty of Economics,0.455,0.038
134,RAE-Revista de Administracao de Empresas,0.404,0.036
135,Journal of World Energy Law & Business,0.400,0.078
136,RBGN-Revista Brasileira de Gestao de Negocios,0.278,0.035
137,South African Journal of Business Management,0.277,0.057
138,Revista de Historia Industrial,0.254,0.207
139,Custos e Agronegocio On Line,0.205,0.018
140,BETRIEBSWIRTSCHAFTLICHE FORSCHUNG UND PRAXIS,0.167,0.013
Copyright © 2019 Clarivate Analytics,,,
"By exporting the selected data, you agree to the data usage policy set forth in the Terms of Use",,,
