"Journal Data Filtered By:  Selected JCR Year: 2018 Selected Editions: SCIE,SSCI Selected Categories: 'EDUCATION & EDUCATIONAL RESEARCH','EDUCATION, SCIENTIFIC DISCIPLINES','EDUCATION, SPECIAL' Selected Category Scheme: WoS",,,,,
Rank,Full Journal Title,Total Cites,Journal Impact Factor,Eigenfactor Score,Article Influence Score
1,REVIEW OF EDUCATIONAL RESEARCH,"9,451",8.985,0.005970,3.770
2,EDUCATIONAL PSYCHOLOGIST,"5,468",5.956,0.003880,3.033
3,COMPUTERS & EDUCATION,"14,601",5.627,0.013400,0.967
4,Internet and Higher Education,"2,738",5.284,0.002680,1.232
5,Educational Research Review,"1,677",5.204,0.003290,2.314
6,ACADEMIC MEDICINE,"15,669",4.937,0.027260,2.081
7,MEDICAL EDUCATION,"10,341",4.619,0.011760,1.790
8,Anatomical Sciences Education,"1,873",4.027,0.002070,0.550
9,LEARNING AND INSTRUCTION,"5,202",3.917,0.007320,1.844
10,MODERN LANGUAGE JOURNAL,"4,142",3.762,0.003310,1.027
11,JOURNAL OF THE LEARNING SCIENCES,"2,376",3.545,0.001610,1.408
12,Educational Researcher,"7,010",3.386,0.006330,2.274
13,Comunicar,"1,367",3.338,0.000760,0.288
14,Academy of Management Learning & Education,"2,868",3.274,0.001970,0.979
15,JOURNAL OF TEACHER EDUCATION,"3,348",3.263,0.002050,1.059
16,Studies in Science Education,637,3.250,0.000610,1.552
16,Studies in Science Education,637,3.250,0.000610,1.552
18,JOURNAL OF ENGINEERING EDUCATION,"2,794",3.244,0.001290,0.890
18,JOURNAL OF ENGINEERING EDUCATION,"2,794",3.244,0.001290,0.890
20,AMERICAN EDUCATIONAL RESEARCH JOURNAL,"5,966",3.170,0.006000,2.177
21,SOCIOLOGY OF EDUCATION,"2,885",3.146,0.003110,2.381
22,JOURNAL OF RESEARCH IN SCIENCE TEACHING,"6,499",3.135,0.004420,1.254
23,EDUCATIONAL EVALUATION AND POLICY ANALYSIS,"2,167",3.127,0.004720,2.384
24,JOURNAL FOR RESEARCH IN MATHEMATICS EDUCATION,"2,484",3.063,0.000960,0.817
25,HIGHER EDUCATION,"6,182",3.005,0.005130,0.751
26,JOURNAL OF EXPERIMENTAL EDUCATION,"2,004",2.919,0.002210,1.156
27,SCIENCE EDUCATION,"4,911",2.897,0.003160,1.143
28,JOURNAL OF NUTRITION EDUCATION AND BEHAVIOR,"3,912",2.869,0.005770,0.951
29,EXCEPTIONAL CHILDREN,"2,739",2.854,0.002580,1.527
29,STUDIES IN HIGHER EDUCATION,"5,281",2.854,0.005310,0.659
31,EARLY CHILDHOOD RESEARCH QUARTERLY,"4,266",2.835,0.005550,1.205
32,ADVANCES IN HEALTH SCIENCES EDUCATION,"2,697",2.761,0.005410,1.234
32,ADVANCES IN HEALTH SCIENCES EDUCATION,"2,697",2.761,0.005410,1.234
34,Metacognition and Learning,776,2.750,0.001200,1.229
35,TESOL QUARTERLY,"3,936",2.718,0.002650,0.994
36,MEDICAL TEACHER,"7,977",2.706,0.010520,0.930
37,READING RESEARCH QUARTERLY,"2,838",2.696,0.002030,1.340
38,JOURNAL OF EDUCATION POLICY,"2,425",2.684,0.002850,0.974
39,JOURNAL OF POSITIVE BEHAVIOR INTERVENTIONS,"1,069",2.641,0.001200,0.886
40,International Journal of Bilingual Education and Bilingualism,"1,423",2.620,0.002220,0.784
41,REMEDIAL AND SPECIAL EDUCATION,"1,898",2.617,0.002900,1.356
42,BRITISH JOURNAL OF EDUCATIONAL TECHNOLOGY,"3,731",2.588,0.003290,0.492
43,JOURNAL OF LEARNING DISABILITIES,"3,462",2.578,0.003290,1.081
44,LANGUAGE LEARNING & TECHNOLOGY,"1,343",2.571,0.001480,0.771
45,Journal of Studies in International Education,"1,697",2.547,0.001160,0.633
46,JOURNAL OF HIGHER EDUCATION,"3,029",2.508,0.001850,0.911
47,Hematology-American Society of Hematology Education Program,"2,944",2.497,0.007260,1.159
48,Review of Research in Education,"1,301",2.488,0.001410,1.425
49,Journal of Research on Educational Effectiveness,638,2.485,0.002740,1.662
50,Assessment in Education-Principles Policy & Practice,"1,107",2.475,0.001020,Not Available
51,Assessment & Evaluation in Higher Education,"3,266",2.473,0.002360,0.476
52,SCIENTIFIC STUDIES OF READING,"1,943",2.470,0.002710,1.418
53,COMPARATIVE EDUCATION,"1,312",2.455,0.001090,0.582
54,JOURNAL OF COMPUTER ASSISTED LEARNING,"2,272",2.451,0.001760,0.601
55,NURSE EDUCATION TODAY,"7,378",2.442,0.008060,0.495
56,Education Finance and Policy,491,2.429,0.002020,1.460
57,TEACHING AND TEACHER EDUCATION,"8,769",2.411,0.006600,0.666
58,CBE-Life Sciences Education,"2,264",2.380,0.004010,0.838
59,Learning Media and Technology,861,2.373,0.000960,0.510
60,JOURNAL OF FLUENCY DISORDERS,"1,419",2.349,0.000870,0.611
61,Language Teaching Research,"1,256",2.319,0.001260,0.643
62,IEEE Transactions on Learning Technologies,868,2.315,0.001020,0.473
63,EDUCATIONAL ADMINISTRATION QUARTERLY,"1,979",2.313,0.001310,0.816
64,BRITISH JOURNAL OF EDUCATIONAL STUDIES,976,2.298,0.000860,0.582
65,Active Learning in Higher Education,753,2.294,0.000590,0.546
66,ADVANCES IN PHYSIOLOGY EDUCATION,"1,737",2.287,0.001860,0.569
67,European Journal of Teacher Education,815,2.286,0.000970,0.445
68,Chemistry Education Research and Practice,"1,709",2.285,0.002470,0.598
68,Chemistry Education Research and Practice,"1,709",2.285,0.002470,0.598
70,Environmental Education Research,"2,851",2.255,0.001570,0.401
71,TEACHING AND LEARNING IN MEDICINE,"1,246",2.216,0.002540,0.677
72,IEEE TRANSACTIONS ON EDUCATION,"1,591",2.214,0.000980,0.381
73,Journal of Surgical Education,"2,728",2.209,0.007620,0.803
74,International Journal of Computer-Supported Collaborative Learning,710,2.206,0.000740,0.664
75,HARVARD EDUCATIONAL REVIEW,"3,281",2.190,0.002440,1.558
76,ANNALS OF DYSLEXIA,859,2.171,0.000690,0.669
77,EDUCATIONAL TECHNOLOGY & SOCIETY,"3,273",2.133,0.002960,0.421
78,ETR&D-EDUCATIONAL TECHNOLOGY RESEARCH AND DEVELOPMENT,"2,593",2.115,0.001790,0.532
79,Critical Studies in Education,695,2.106,0.001170,0.746
80,Mind Brain and Education,632,2.103,0.001130,0.716
81,Learning Disabilities Research & Practice,923,2.077,0.001000,0.826
82,URBAN EDUCATION,"1,552",2.043,0.002020,0.815
83,JOURNAL OF ENVIRONMENTAL EDUCATION,"1,764",2.040,0.000540,0.441
84,Physical Education and Sport Pedagogy,"1,163",2.035,0.001450,0.560
85,Computer Assisted Language Learning,"1,043",2.018,0.001170,0.465
86,European Physical Education Review,873,2.000,0.000990,0.502
86,LANGUAGE LEARNING,"3,675",2.000,0.003290,1.192
88,Physical Review Physics Education Research,365,1.964,0.001280,0.590
88,Physical Review Physics Education Research,365,1.964,0.001280,0.590
90,Journal of School Violence,706,1.962,0.001090,Not Available
90,SPORT EDUCATION AND SOCIETY,"1,694",1.962,0.001770,0.449
92,RESEARCH IN HIGHER EDUCATION,"3,213",1.961,0.002520,1.027
93,EDUCATIONAL POLICY,"1,064",1.955,0.001640,0.756
94,COMPARATIVE EDUCATION REVIEW,"1,196",1.952,0.001350,0.728
94,MINERVA,"1,081",1.952,0.000890,0.677
96,READING AND WRITING,"2,992",1.942,0.004310,0.868
97,JOURNAL OF INTELLECTUAL DISABILITY RESEARCH,"5,114",1.941,0.004760,0.735
98,SYSTEM,"2,993",1.930,0.003380,0.586
99,INTERACTIVE LEARNING ENVIRONMENTS,"1,012",1.929,0.001450,0.342
100,International Journal of Educational Technology in Higher Education,177,1.922,0.000210,0.214
101,JOURNAL OF LITERACY RESEARCH,704,1.886,0.000930,0.808
102,BRITISH JOURNAL OF SOCIOLOGY OF EDUCATION,"2,161",1.883,0.002650,0.671
103,ACADEMIC PSYCHIATRY,"1,425",1.880,0.002330,0.417
104,RESEARCH IN DEVELOPMENTAL DISABILITIES,"7,158",1.872,0.013310,0.660
105,BMC Medical Education,"4,585",1.870,0.010150,0.610
105,BMC Medical Education,"4,585",1.870,0.010150,0.610
105,Journal of Computing in Higher Education,362,1.870,0.000450,0.431
108,AIDS EDUCATION AND PREVENTION,"1,758",1.854,0.002330,0.857
109,Assessing Writing,514,1.841,0.000770,0.579
110,International Review of Research in Open and Distributed Learning,"2,188",1.830,0.001860,0.323
111,Higher Education Research & Development,"2,809",1.824,0.002510,0.429
112,QUEST,"1,398",1.819,0.001070,0.480
113,SCHOOL EFFECTIVENESS AND SCHOOL IMPROVEMENT,"1,238",1.815,0.001230,0.664
114,Educational Management Administration & Leadership,"1,136",1.804,0.000960,0.276
115,Research in Autism Spectrum Disorders,"3,161",1.799,0.005960,0.719
116,Teachers and Teaching,"1,521",1.798,0.001790,0.535
117,RESEARCH AND PRACTICE FOR PERSONS WITH SEVERE DISABILITIES,616,1.795,0.001020,0.793
118,Journal of Science Education and Technology,"1,731",1.785,0.001740,0.411
118,Journal of Science Education and Technology,"1,731",1.785,0.001740,0.411
120,FOREIGN LANGUAGE ANNALS,"1,552",1.782,0.000730,0.273
121,JOURNAL OF EMOTIONAL AND BEHAVIORAL DISORDERS,"1,168",1.775,0.000940,0.705
121,JOURNAL OF TEACHING IN PHYSICAL EDUCATION,"1,413",1.775,0.000970,0.417
123,JOURNAL OF EDUCATIONAL AND BEHAVIORAL STATISTICS,"2,047",1.767,0.002910,1.919
124,Compare-A Journal of Comparative and International Education,944,1.765,0.001460,0.463
125,JOURNAL OF CHEMICAL EDUCATION,"12,588",1.763,0.005320,0.221
126,SECOND LANGUAGE RESEARCH,949,1.750,0.000940,0.684
127,AJIDD-American Journal on Intellectual and Developmental Disabilities,940,1.742,0.001690,0.754
128,AMERICAN JOURNAL OF PHARMACEUTICAL EDUCATION,"4,209",1.737,0.002090,0.214
129,Journal of English for Academic Purposes,"1,221",1.732,0.001280,0.591
130,EDUCATIONAL REVIEW,"1,144",1.730,0.000950,0.497
131,Distance Education,831,1.729,0.000730,0.457
132,Educational Assessment Evaluation and Accountability,420,1.722,0.000440,0.388
133,Discourse-Studies in the Cultural Politics of Education,"1,439",1.721,0.002420,0.626
134,Medical Education Online,795,1.715,0.002170,0.594
134,TEACHING IN HIGHER EDUCATION,"1,960",1.715,0.001710,0.370
136,Technology Pedagogy and Education,476,1.712,0.000570,0.281
137,Cambridge Journal of Education,"1,196",1.705,0.001230,0.628
138,JOURNAL OF CANCER EDUCATION,"2,007",1.690,0.003670,0.477
139,Studies in Educational Evaluation,834,1.684,0.001160,0.442
140,RESEARCH IN THE TEACHING OF ENGLISH,767,1.675,0.001150,0.913
141,Thinking Skills and Creativity,884,1.655,0.001120,0.325
142,TOPICS IN EARLY CHILDHOOD SPECIAL EDUCATION,886,1.615,0.000900,0.677
143,Psicologia Educativa,102,1.613,0.000300,Not Available
144,Educacion XX1,418,1.597,0.000210,0.100
145,EDUCATIONAL RESEARCH,980,1.585,0.000760,0.427
146,Intellectual and Developmental Disabilities,952,1.582,0.001620,0.717
147,Australasian Journal of Educational Technology,"1,312",1.578,0.000770,0.230
148,INSTRUCTIONAL SCIENCE,"2,143",1.576,0.002080,0.769
149,Language Culture and Curriculum,523,1.571,0.000810,0.662
150,DYSLEXIA,842,1.568,0.000860,0.653
151,Language Teaching,"1,295",1.565,0.001470,0.977
152,Journal of Deaf Studies and Deaf Education,"1,483",1.556,0.001000,0.436
153,JOURNAL OF EDUCATIONAL COMPUTING RESEARCH,"1,292",1.543,0.000790,0.266
154,Early Education and Development,"1,937",1.539,0.002640,0.625
155,JOURNAL OF SPECIAL EDUCATION,"1,291",1.537,0.001290,0.941
156,JOURNAL OF GEOGRAPHY IN HIGHER EDUCATION,"1,061",1.533,0.000670,0.246
157,European Journal of Dental Education,"1,182",1.531,0.000860,0.269
158,LEARNING DISABILITY QUARTERLY,871,1.525,0.000860,0.693
159,JOURNAL OF SCHOOL HEALTH,"3,621",1.521,0.004340,0.632
159,JOURNAL OF SCHOOL HEALTH,"3,621",1.521,0.004340,0.632
161,ECONOMICS OF EDUCATION REVIEW,"3,701",1.519,0.006640,1.262
161,Journal of Hospitality Leisure Sport & Tourism Education,371,1.519,0.000190,0.120
163,Linguistics and Education,872,1.516,0.001130,0.453
164,REVIEW OF HIGHER EDUCATION,"1,246",1.500,0.000880,0.739
165,Sex Education-Sexuality Society and Learning,730,1.479,0.001050,0.315
166,JOURNAL OF INTELLECTUAL & DEVELOPMENTAL DISABILITY,"1,253",1.467,0.001010,0.416
167,JOURNAL OF AMERICAN COLLEGE HEALTH,"3,309",1.455,0.002500,0.574
168,ADULT EDUCATION QUARTERLY,744,1.438,0.000290,0.258
169,International Journal of Sustainability in Higher Education,"1,664",1.437,0.000630,0.220
170,COMPUTER APPLICATIONS IN ENGINEERING EDUCATION,908,1.435,0.000490,0.090
171,Scandinavian Journal of Educational Research,963,1.432,0.001030,0.371
172,JOURNAL OF CURRICULUM STUDIES,"1,759",1.420,0.001100,0.407
173,INTERNATIONAL JOURNAL OF EDUCATIONAL DEVELOPMENT,"1,784",1.406,0.002070,0.396
174,Journal of Agricultural Education & Extension,494,1.388,0.000570,Not Available
175,Exceptionality,451,1.382,0.000430,0.420
175,RESEARCH IN SCIENCE EDUCATION,"1,533",1.382,0.001720,0.445
177,International Journal of Multilingualism,520,1.375,0.000690,Not Available
178,JOURNAL OF EDUCATION FOR TEACHING,763,1.373,0.000900,0.339
179,JOURNAL OF PROFESSIONAL ISSUES IN ENGINEERING EDUCATION AND PRACTICE,690,1.372,0.000380,0.137
180,Mind Culture and Activity,732,1.367,0.000620,0.426
181,BRITISH EDUCATIONAL RESEARCH JOURNAL,"2,540",1.364,0.002360,0.639
182,ReCALL,633,1.361,0.000720,0.598
183,ACM Transactions on Computing Education,326,1.356,0.000550,0.396
184,ELT Journal,"1,608",1.351,0.000760,0.325
185,Educational Measurement-Issues and Practice,834,1.350,0.001300,1.125
186,THEORY INTO PRACTICE,"3,028",1.347,0.001520,0.622
187,BEHAVIORAL DISORDERS,677,1.343,0.000520,0.462
187,Vocations and Learning,308,1.343,0.000320,0.279
189,International Journal of Educational Research,"1,960",1.341,0.002040,0.430
190,Higher Education Policy,809,1.333,0.000540,0.300
191,Focus on Autism and Other Developmental Disabilities,701,1.327,0.001160,0.733
192,JOURNAL OF RESEARCH IN READING,"1,071",1.323,0.001230,0.640
193,INTERNATIONAL JOURNAL OF TECHNOLOGY AND DESIGN EDUCATION,573,1.319,0.000440,0.178
194,AMERICAN JOURNAL OF EDUCATION,"1,156",1.316,0.001290,1.001
195,Journal of Higher Education Policy and Management,940,1.310,0.000770,Not Available
196,GIFTED CHILD QUARTERLY,916,1.304,0.000330,0.236
197,HEALTH EDUCATION RESEARCH,"4,309",1.301,0.003450,0.723
198,JOURNAL OF EARLY INTERVENTION,759,1.294,0.000740,0.662
198,Journal of Diversity in Higher Education,479,1.294,0.000810,0.591
200,Educational Studies in Mathematics,"2,622",1.292,0.001020,0.243
201,OXFORD REVIEW OF EDUCATION,"1,553",1.274,0.001600,0.549
202,Educational Philosophy and Theory,"1,311",1.267,0.001460,0.232
203,JOURNAL OF CONTINUING EDUCATION IN THE HEALTH PROFESSIONS,"1,454",1.265,0.002110,0.692
204,Professional Development in Education,692,1.258,0.000820,Not Available
205,INTERNATIONAL JOURNAL OF SCIENCE EDUCATION,"5,209",1.255,0.003940,0.469
206,Educational Psychology,"2,092",1.254,0.002260,0.543
207,JOURNAL OF ADOLESCENT & ADULT LITERACY,"1,275",1.250,0.001470,0.397
208,Race Ethnicity and Education,"1,248",1.228,0.001430,0.487
209,Mathematical Thinking and Learning,647,1.222,0.000350,0.406
210,European Early Childhood Education Research Journal,771,1.215,0.001080,0.322
211,Science & Education,"1,152",1.210,0.001280,0.295
212,AMERICAN JOURNAL OF PHYSICS,"8,266",1.194,0.003140,0.403
213,INNOVATIONS IN EDUCATION AND TEACHING INTERNATIONAL,978,1.171,0.000800,0.227
214,GENDER AND EDUCATION,"1,542",1.170,0.001450,0.423
215,READING TEACHER,"1,556",1.168,0.000870,0.246
216,Language and Education,792,1.164,0.001000,0.486
217,JOURNAL OF EDUCATIONAL RESEARCH,"2,885",1.155,0.001490,0.503
218,AUSTRALIAN JOURNAL OF EDUCATION,483,1.147,0.000500,0.418
219,Learning Culture and Social Interaction,279,1.143,0.000590,0.298
219,Studies in Continuing Education,528,1.143,0.000260,0.194
221,ELEMENTARY SCHOOL JOURNAL,"2,186",1.140,0.001440,0.816
222,Research Papers in Education,706,1.109,0.000860,0.422
223,Journal of Behavioral Education,744,1.087,0.001180,Not Available
224,Asia Pacific Journal of Education,529,1.071,0.000790,0.328
225,Journal of Mental Health Research in Intellectual Disabilities,235,1.059,0.000430,0.415
226,Literacy,257,1.054,0.000460,0.378
227,International Journal of Inclusive Education,"1,372",1.053,0.001420,0.257
228,Early Childhood Education Journal,"1,302",1.052,0.001240,Not Available
229,APPLIED MEASUREMENT IN EDUCATION,680,1.043,0.000590,0.430
230,European Journal of Special Needs Education,815,1.039,0.000710,0.293
231,International Journal of Science and Mathematics Education,"1,099",1.027,0.001480,0.284
232,Journal of Baltic Science Education,337,1.024,0.000280,0.070
233,TEACHING SOCIOLOGY,721,1.019,0.000230,0.131
234,JOURNAL OF MORAL EDUCATION,832,1.015,0.000480,0.242
235,AUSTRALIAN EDUCATIONAL RESEARCHER,494,1.000,0.000530,0.255
235,Language Policy,547,1.000,0.001060,0.849
237,CURRICULUM INQUIRY,921,0.981,0.000840,0.514
238,TEACHING OF PSYCHOLOGY,"1,276",0.980,0.000760,0.223
239,Current Issues in Language Planning,355,0.978,0.000650,Not Available
240,European Journal of Education,"1,108",0.975,0.001050,0.396
241,EDUCATION AND URBAN SOCIETY,657,0.972,0.000760,0.339
242,JOURNAL OF DEVELOPMENTAL AND PHYSICAL DISABILITIES,911,0.954,0.001780,0.523
243,Engineering Studies,154,0.952,0.000140,0.133
244,Revista Latinoamericana de Investigacion en Matematica Educativa-RELIME,96,0.950,0.000050,0.072
245,Music Education Research,511,0.948,0.000270,0.142
246,BIOCHEMISTRY AND MOLECULAR BIOLOGY EDUCATION,977,0.947,0.000900,0.230
247,INTERNATIONAL JOURNAL OF ELECTRICAL ENGINEERING EDUCATION,239,0.941,0.000110,0.063
248,Reading & Writing Quarterly,582,0.934,0.000560,0.391
249,TEACHERS COLLEGE RECORD,"3,957",0.910,0.004020,0.622
250,JOURNAL OF SOCIAL WORK EDUCATION,"1,271",0.906,0.000620,0.154
251,Asia-Pacific Journal of Teacher Education,649,0.903,0.000460,0.242
252,Education and Treatment of Children,"1,031",0.898,0.001010,0.536
253,Cultura y Educacion,500,0.885,0.000210,0.101
254,Teacher Education and Special Education,573,0.884,0.000390,0.283
255,Research in Science & Technological Education,405,0.875,0.000290,0.216
256,Revista Espanola de Pedagogia,331,0.863,0.000030,0.018
257,International Review of Research in Developmental Disabilities,97,0.862,0.000330,0.347
258,EUROPEAN JOURNAL OF PHYSICS,"2,126",0.861,0.002230,0.180
259,Child Language Teaching & Therapy,421,0.860,0.000590,0.413
260,Asia Pacific Education Review,735,0.847,0.000770,0.224
261,Asia-Pacific Education Researcher,483,0.846,0.000830,0.186
261,STUDIES IN PHILOSOPHY AND EDUCATION,575,0.846,0.000510,0.190
263,JOURNAL OF BIOLOGICAL EDUCATION,648,0.844,0.000450,0.229
263,JOURNAL OF BIOLOGICAL EDUCATION,648,0.844,0.000450,0.229
265,HEALTH EDUCATION JOURNAL,786,0.839,0.001180,0.252
266,Education and Training in Autism and Developmental Disabilities,504,0.824,0.001160,0.468
267,JOURNAL OF RESEARCH IN MUSIC EDUCATION,"1,012",0.820,0.000530,0.302
268,International Journal of Disability Development and Education,647,0.818,0.000610,0.282
269,Ensenanza de Las Ciencias,531,0.814,0.000160,0.062
270,JOURNAL OF PHILOSOPHY OF EDUCATION,805,0.798,0.000670,0.241
271,JOURNAL OF COLLEGE STUDENT DEVELOPMENT,"2,688",0.784,0.001370,0.300
272,EDUCATIONAL STUDIES,818,0.776,0.000730,0.298
273,EDUCATIONAL GERONTOLOGY,"1,354",0.748,0.000890,0.202
274,Journal of Language Identity and Education,507,0.736,0.000750,0.472
275,International Journal for Educational and Vocational Guidance,235,0.730,0.000250,0.231
276,Early Child Development and Care,"1,582",0.713,0.001780,Not Available
277,English Teaching-Practice and Critique,294,0.704,0.000240,0.139
278,JOURNAL OF VETERINARY MEDICAL EDUCATION,696,0.697,0.000550,0.154
279,South African Journal of Education,717,0.693,0.000380,0.108
280,INTERVENTION IN SCHOOL AND CLINIC,464,0.682,0.000290,0.113
281,Zeitschrift fur Erziehungswissenschaft,575,0.673,0.000720,0.174
282,British Journal of Religious Education,296,0.667,0.000140,0.114
282,IRAL-INTERNATIONAL REVIEW OF APPLIED LINGUISTICS IN LANGUAGE TEACHING,571,0.667,0.000620,0.585
284,ANTHROPOLOGY & EDUCATION QUARTERLY,941,0.660,0.000460,0.272
285,JOURNAL OF ECONOMIC EDUCATION,797,0.653,0.000330,0.143
286,JOURNAL OF LEGAL EDUCATION,360,0.651,0.000300,0.130
287,AMERICAN ANNALS OF THE DEAF,719,0.638,0.000250,0.176
287,PHYSICS TEACHER,"1,115",0.638,0.000910,0.129
289,INTERNATIONAL JOURNAL OF ENGINEERING EDUCATION,"1,360",0.611,0.000790,0.070
290,Egitim ve Bilim-Education and Science,597,0.607,0.000470,0.062
291,Australasian Journal of Early Childhood,483,0.606,0.000490,0.140
292,Education as Change,178,0.585,0.000250,0.126
293,International Review of Economics Education,146,0.545,0.000110,Not Available
294,Irish Educational Studies,244,0.531,0.000330,0.209
295,International Journal of Music Education,464,0.506,0.000410,0.172
295,Porta Linguarum,230,0.506,0.000210,0.088
297,British Journal of Learning Disabilities,664,0.500,0.000640,0.239
298,History of Education,448,0.482,0.000380,0.149
299,HIGH ABILITY STUDIES,353,0.480,0.000170,0.230
300,International Journal of Developmental Disabilities,95,0.472,0.000280,0.183
301,English in Education,108,0.469,0.000150,0.157
302,Australian Journal of Adult Learning,161,0.467,0.000140,0.097
303,Journal of Materials Education,141,0.455,0.000070,0.078
304,Infants & Young Children,641,0.447,0.000330,0.217
305,British Journal of Music Education,412,0.444,0.000170,0.148
306,English in Australia,137,0.440,0.000100,0.065
307,Indian Journal of Pharmaceutical Education and Research,414,0.425,0.000370,0.055
308,Journal of Psychologists and Counsellors in Schools,29,0.424,0.000060,0.099
309,KEDI Journal of Educational Policy,79,0.423,0.000080,0.100
310,Journal of Beliefs & Values-Studies in Religion & Education,206,0.404,0.000080,0.048
311,PAEDAGOGICA HISTORICA,377,0.402,0.000440,0.145
312,PHI DELTA KAPPAN,"1,668",0.368,0.000760,0.125
313,INTERNATIONAL JOURNAL OF ART & DESIGN EDUCATION,300,0.333,0.000060,0.035
314,Revista de Educacion,318,0.310,0.000200,0.064
315,Movimento,330,0.307,0.000170,0.031
316,ZEITSCHRIFT FUR PADAGOGIK,406,0.286,0.000320,0.084
317,EDUCATIONAL LEADERSHIP,"2,226",0.281,0.000640,0.101
317,RIDE-The Journal of Applied Theatre and Performance,211,0.281,0.000140,0.053
319,AMERICAN BIOLOGY TEACHER,673,0.276,0.000320,0.067
320,Zeitschrift fur Soziologie der Erziehung und Sozialisation,69,0.200,0.000050,0.033
321,Pedagogische Studien,83,0.140,0.000070,0.041
322,Croatian Journal of Education-Hrvatski Casopis za Odgoj i obrazovanje,101,0.109,0.000170,0.035
323,Cadmo,13,0.034,0.000030,0.038
324,Curriculum Matters,12,0.000,0.000000,0.000
Copyright © 2019 Clarivate Analytics,,,,,
"By exporting the selected data, you agree to the data usage policy set forth in the Terms of Use",,,,,
